{
	"compiler": {
		"version": "0.8.15+commit.e14f2714"
	},
	"language": "Solidity",
	"output": {
		"abi": [
			{
				"anonymous": false,
				"inputs": [
					{
						"indexed": true,
						"internalType": "address",
						"name": "token0",
						"type": "address"
					},
					{
						"indexed": true,
						"internalType": "address",
						"name": "token1",
						"type": "address"
					},
					{
						"indexed": false,
						"internalType": "address",
						"name": "pair",
						"type": "address"
					},
					{
						"indexed": false,
						"internalType": "uint256",
						"name": "",
						"type": "uint256"
					}
				],
				"name": "PairCreated",
				"type": "event"
			},
			{
				"inputs": [
					{
						"internalType": "uint256",
						"name": "",
						"type": "uint256"
					}
				],
				"name": "allPairs",
				"outputs": [
					{
						"internalType": "address",
						"name": "pair",
						"type": "address"
					}
				],
				"stateMutability": "view",
				"type": "function"
			},
			{
				"inputs": [],
				"name": "allPairsLength",
				"outputs": [
					{
						"internalType": "uint256",
						"name": "",
						"type": "uint256"
					}
				],
				"stateMutability": "view",
				"type": "function"
			},
			{
				"inputs": [
					{
						"internalType": "address",
						"name": "tokenA",
						"type": "address"
					},
					{
						"internalType": "address",
						"name": "tokenB",
						"type": "address"
					}
				],
				"name": "createPair",
				"outputs": [
					{
						"internalType": "address",
						"name": "pair",
						"type": "address"
					}
				],
				"stateMutability": "nonpayable",
				"type": "function"
			},
			{
				"inputs": [],
				"name": "feeTo",
				"outputs": [
					{
						"internalType": "address",
						"name": "",
						"type": "address"
					}
				],
				"stateMutability": "view",
				"type": "function"
			},
			{
				"inputs": [],
				"name": "feeToSetter",
				"outputs": [
					{
						"internalType": "address",
						"name": "",
						"type": "address"
					}
				],
				"stateMutability": "view",
				"type": "function"
			},
			{
				"inputs": [
					{
						"internalType": "address",
						"name": "tokenA",
						"type": "address"
					},
					{
						"internalType": "address",
						"name": "tokenB",
						"type": "address"
					}
				],
				"name": "getPair",
				"outputs": [
					{
						"internalType": "address",
						"name": "pair",
						"type": "address"
					}
				],
				"stateMutability": "view",
				"type": "function"
			},
			{
				"inputs": [
					{
						"internalType": "address",
						"name": "",
						"type": "address"
					}
				],
				"name": "setFeeTo",
				"outputs": [],
				"stateMutability": "nonpayable",
				"type": "function"
			},
			{
				"inputs": [
					{
						"internalType": "address",
						"name": "",
						"type": "address"
					}
				],
				"name": "setFeeToSetter",
				"outputs": [],
				"stateMutability": "nonpayable",
				"type": "function"
			}
		],
		"devdoc": {
			"kind": "dev",
			"methods": {},
			"version": 1
		},
		"userdoc": {
			"kind": "user",
			"methods": {},
			"version": 1
		}
	},
	"settings": {
		"compilationTarget": {
			"interfaces/IUniswapV2Factory.sol": "IUniswapV2Factory"
		},
		"evmVersion": "byzantium",
		"libraries": {},
		"metadata": {
			"bytecodeHash": "ipfs",
			"useLiteralContent": true
		},
		"optimizer": {
			"enabled": true,
			"runs": 200
		},
		"remappings": [],
		"viaIR": true
	},
	"sources": {
		"interfaces/IUniswapV2Factory.sol": {
			"content": "// SPDX-License-Identifier: GPL-3.0\r\n\r\npragma solidity 0.8.15;\r\n\r\ninterface IUniswapV2Factory {\r\n    event PairCreated(address indexed token0, address indexed token1, address pair, uint);\r\n\r\n    function feeTo() external view returns (address);\r\n    function feeToSetter() external view returns (address);\r\n\r\n    function getPair(address tokenA, address tokenB) external view returns (address pair);\r\n    function allPairs(uint) external view returns (address pair);\r\n    function allPairsLength() external view returns (uint);\r\n\r\n    function createPair(address tokenA, address tokenB) external returns (address pair);\r\n\r\n    function setFeeTo(address) external;\r\n    function setFeeToSetter(address) external;\r\n}\r\n",
			"keccak256": "0xb819a269e9e17909eabe7fd068064ce23ea895cd13bde4aa830f330dff1df058",
			"license": "GPL-3.0"
		}
	},
	"version": 1
}